{
  "schema_version": "1.0.0",
  "document_type": "ingest-plan",
  "document_id": "ingest-plan_plan_demo_02",
  "created_at": "2026-07-18T12:00:00Z",
  "workspace": "lab_demo",
  "source_id": "src_demo_02",
  "source_hash": {
    "algorithm": "sha256",
    "value": "2222222222222222222222222222222222222222222222222222222222222222"
  },
  "review_generation": 1,
  "producer": {
    "kind": "ENGINE",
    "name": "s9k-data-engine",
    "version": "0.3.0",
    "model": null
  },
  "provenance": {
    "source_id": "src_demo_02",
    "source_hash": {
      "algorithm": "sha256",
      "value": "2222222222222222222222222222222222222222222222222222222222222222"
    },
    "review_generation": 1,
    "pipeline_version": "0.3.0",
    "producer": {
      "kind": "ENGINE",
      "name": "s9k-data-engine",
      "version": "0.3.0",
      "model": null
    }
  },
  "plan_id": "plan_demo_02",
  "plan_version": "1.0.0",
  "review_document_id": "rev_src_demo_02",
  "review_hash": {
    "algorithm": "sha256",
    "value": "2222222222222222222222222222222222222222222222222222222222222222"
  },
  "created_by": {
    "kind": "ENGINE",
    "name": "s9k-data-engine",
    "version": "0.3.0",
    "model": null
  },
  "status": "BLOCKED",
  "relations_enabled": false,
  "preconditions": [
    {
      "precondition_id": "pre_001",
      "kind": "REVIEW_HASH_MATCHES",
      "expected": "2222222222222222222222222222222222222222222222222222222222222222"
    }
  ],
  "operations": [],
  "deferred_items": [
    "cand_b1"
  ],
  "conflicts": [
    {
      "candidate_id": "cand_b2",
      "reason": "duplicado ambiguo"
    }
  ],
  "warnings": [],
  "summary": {
    "would_create": 0,
    "would_update": 0,
    "would_link_existing": 0,
    "deferred": 1,
    "conflicts": 1,
    "relations": 0
  },
  "authorization": {
    "required": true,
    "granted": false
  }
}