{
  "schema_version": "1.0.0",
  "document_type": "ingest-plan",
  "document_id": "ingest-plan_plan_demo_01",
  "created_at": "2026-07-18T12:00:00Z",
  "workspace": "lab_demo",
  "source_id": "src_demo_01",
  "source_hash": {
    "algorithm": "sha256",
    "value": "1111111111111111111111111111111111111111111111111111111111111111"
  },
  "review_generation": 1,
  "producer": {
    "kind": "ENGINE",
    "name": "s9k-data-engine",
    "version": "0.3.0",
    "model": null
  },
  "provenance": {
    "source_id": "src_demo_01",
    "source_hash": {
      "algorithm": "sha256",
      "value": "1111111111111111111111111111111111111111111111111111111111111111"
    },
    "review_generation": 1,
    "pipeline_version": "0.3.0",
    "producer": {
      "kind": "ENGINE",
      "name": "s9k-data-engine",
      "version": "0.3.0",
      "model": null
    }
  },
  "plan_id": "plan_demo_01",
  "plan_version": "1.0.0",
  "review_document_id": "rev_src_demo_01",
  "review_hash": {
    "algorithm": "sha256",
    "value": "1111111111111111111111111111111111111111111111111111111111111111"
  },
  "created_by": {
    "kind": "ENGINE",
    "name": "s9k-data-engine",
    "version": "0.3.0",
    "model": null
  },
  "status": "READY_TO_APPLY",
  "relations_enabled": false,
  "preconditions": [
    {
      "precondition_id": "pre_001",
      "kind": "REVIEW_HASH_MATCHES",
      "expected": "1111111111111111111111111111111111111111111111111111111111111111"
    }
  ],
  "operations": [
    {
      "operation_id": "op_001",
      "operation_type": "CREATE_ENTITY",
      "candidate_id": "cand_a1",
      "target_entity_id": null,
      "payload": {
        "canonical_name": "Personaje Alfa"
      },
      "provenance": {
        "source_id": "src_demo_01",
        "source_hash": {
          "algorithm": "sha256",
          "value": "1111111111111111111111111111111111111111111111111111111111111111"
        },
        "review_generation": 1,
        "pipeline_version": "0.3.0",
        "producer": {
          "kind": "ENGINE",
          "name": "s9k-data-engine",
          "version": "0.3.0",
          "model": null
        }
      },
      "expected_state": "WOULD_CREATE",
      "idempotency_key": "idem_001"
    }
  ],
  "deferred_items": [
    "cand_a1"
  ],
  "conflicts": [],
  "warnings": [],
  "summary": {
    "would_create": 1,
    "would_update": 0,
    "would_link_existing": 1,
    "deferred": 1,
    "conflicts": 0,
    "relations": 0
  },
  "authorization": {
    "required": true,
    "granted": false
  }
}